Grievance,RepliedGrievance
form part 2 is not showing,"Our team is working on that,
Lock the first form then you can able to see second form still facing any problem provide screenshot and check after sometime"
"Sir, i have done my fees payment through upi gpay, but after doing payment its showing  payment is pending and validate it and check after 30 min but it's been 24 hours, please resolve this issue. I have done my payment already.",Kindly check after sometimes
My College Choosing Option Not Available Log In Portal Pls Available in My Dashboard To College Choosing Option,"Now part II is available, please log in to fill the form."
Registration errer fees paid application is not lock i am application is lock try to errer is registration errer show please find and sol my Query and reply please,This issues is solve please Just relog Your account
"At first, payment done was not reflecting on portal so I tried making 2nd time so that time got reflected on portal but my 1st payment not refunded to me. Could you please look into this?
Attaching payment receipt for both the payments.",You will get you payment back except one within 7 working days.
"Dear team

I am unable to see the collages name because part II option not available",working on that please check after sometime
I have done the fee payment and still it shows payment pending.due to that I am not able to lock the form,Kindly check after sometimes
It shows firm is incomplete for the registration details eventhough it is done and complete,This issues is solve please Just relog Your account
PART 2 FORM IS NOT SHOWING,"Our team is working on that,
Lock the first form then you can able to see second form still facing any problem provide screenshot and check after sometime"
"Payment done but not  Process 
User Login ID: A2915916215
User Name: INSHA DILSHAD ANSARI",Check after 4 or 24 hours for bank reconciliation.
"filling all mandatory information in the form but it shows incomplete.
And Payment waiting it's take lengthy time .debited from upi id but showing pending.",Kindly note that payments made via PhonePe or other UPI apps may take some time to reflect. Just refresh you dashboard and check internet connection.
I have filled the application and lock the form but still didn't get the preference form,"If you want to lock form, please check all file are filed, accept declaration and click on Lock application button in Lock Application from screen."
here i have filled all the required documents still it is being showing that registration details are incomplete i request u to see to it ....before also i have send u one screenshot of the issue i really really request u to solve my issue as my admision is pending,Just Recheck ones. you have to fill all mandatory data check registration section there read pop -up massage
we have pay payment but our web page is never show payment please help me..,Kindly check after sometimes
I have completed filling Application Form (Part-I).  Tab for Option/Choice Form (Part - II) is not available.,"Already solved that issue, even if you are facing any problem provide screenshot 
Lock the first form then you can able see second form"
"System Show as Admission processing fee as pending. 
Transaction Details:
UPI Transaction ID: 514713224247

From: santosh.k.bhaskaran@oksbi

Google Transaction ID: CICAgKi40_usIQ",Kindly note that payments made via PhonePe or other UPI apps may take some time to reflect. Just refresh you dashboard and check internet connection.
I have paid the application form fees and its been 1 hour since i paid the fees but still Application Form (Part-2) not visible,Just relog Your account refresh the dashboard.
"we have done the payment twice.
amount has been deducted as well but it is not showing on the portal.",Check after 4 or 24 hours for bank reconciliation.
"I am unable to lock part1 application form after completed all the details .
The attached screen shot for you reference .",your all registration fields not fill. fill all details please.
"second for m not open till  Payment done but not  Process 
User Login ID: A2920155072
User Name: NAZRANA JAKIR SHAIKH

Please Process my application payment screenshot attached here",Just relog Your account refresh the dashboard
Payment Showning Pending,Kindly check after sometimes
Part II option not showing in login,Already solved that problem still facing any problem provide screenshot
In form we are unable to see minority option and cap part2 option,Please try again after some time
"I have duly filled complete Part-I and locked the form but Part-II is not reflecting for further action.
Kindly check and help to resolve this.
Thanks!","Check Again, It has been resolved"
Application form Part 2 not visible,Please check after sometimes.
not showing option,We are already working on that kindly verify/check after sometime.
"Application form shows registration details incomplete eventhough it is autofilled 
not able to lock the application form eventhough everything filled","Please ensure you have filled all mandatory fields before locking the form. Once you successfully lock your Part I form, the status will automatically update to 'Completed'."
The payment window is not working at time,Please verify/check after sometime.
part 2,Kindly verify/check after sometime
"Unable to select the form, part 2. There are no options available.  user id : A3521628954",kindly check after sometime
Need to update the correct seat number in the registration form as the school has send the details today,"We need your consent to change your seat number. Kindly share your details likes name, register mobile number, login id, mail id  and seat number and marksheet."
"Dear Sir/ Ma'am, I'm unable to lock my form & proceed with my application form (part 2) due to error stating incomplete details in registration section which is not true.","Please ensure you have filled all mandatory fields before locking the form. Once you successfully lock your Part I form, the status will automatically update to 'Completed'."
"Respected Sir/Madam,

This is a follow-up to my earlier grievance (Ticket ID: GRVAPL1) regarding a payment issue for FYJC Std. 11th admission.

I had submitted the first grievance on 26th May 2025 explaining that I completed the online payment of ₹102.34 via UPI on 26/05/2025 at 12:15 PM. Despite the amount being successfully deducted from my account, the FYJC portal is still showing the payment status as “Pending.”

Unfortunately, I have not received any update, response, or resolution to that complaint yet. This delay is causing worry as the application might be affected due to this technical issue.

Here are my application details again for reference:

Name of Student: Sanjivan Shamsing Solanki

Application Number: D1474243532

Region: Nashik

Payment Mode: UPI

Amount Paid: ₹102.36

Date & Time of Payment: 26/05/2025 at 12:15 PM

Previous Ticket ID: GRVAPL1

I request you to please look into this matter urgently and update the payment status on the portal so that my application process can move forward without further delay.

I am attaching the payment proof again for your reference.

Thank you for your attention and support.",please check after Sometime
"I paid the fees but not able to get receipt and it showing pending please check the transaction details, i request to please solve 
Best Regards",Please check after sometimes.
TODAY RECIVED LEAVING CERTIFICATE,upload documents
Karanja,?
Karanja,.
"Hi,
Application part 2 not showing on the dashboard.. Please do the needful.",working on that please check after sometime
I have paid fee amount but after two hours also showing pending fee payment,Please check after sometimes.
Part II-College Preference part is not available,We are already working on that kindly verify/check after sometime
fyjc admission,Please check after sometimes.
where is                 application form part 2 ?,"Our team is working on that,
Lock the first form then you can able to see second form still facing any problem provide screenshot and check after sometime"
APPLICATION IS SUCCEFULLY DONE BY UPI APP BUT THET SHOW UNSUCCESFUL ON THE PORTAL AND MONEY DEBITED BY ACCOUNT,Kindly verify/check after sometime
APPLICATION IS SUCCEFULLY DONE BY UPI APP BUT THET SHOW UNSUCCESFUL ON THE PORTAL AND MONEY DEBITED BY ACCOUNT,We are already working on that kindly verify/check after sometime.
APPLICATION IS SUCCEFULLY DONE BY UPI APP BUT THET SHOW UNSUCCESFUL ON THE PORTAL AND MONEY DEBITED BY ACCOUNT,Please verify/check after sometime.
"I paid fees using UPI mode and payment is also deducted from my side but payment is remaining to done in form  this is collecting ID AIR1QZscVf6SMb2AXAT0465983721QPAY02 

And this is UTR  514713526417
And this is transaction ID T2505271332040382805037 

Payment amount: 102.36
Date of payment: 27/May/2025 13:32:08
Mode of payment: UPI
UTR number: 514713526417
1:34",Please check after sometimes.
THERE IS NO PART 2 APPLICATION ON MY DASHBOARD,Kindly check after 7 PM
unable to see or access part II on the portal,Kindly check after 7 PM
My form no 2 not open,Please provide screenshot
I can't select college there no option,We are updating. Please check after sometimes.
"Amount paid, but payment not yet confirmed",Kindly check after sometime
PAYMENT DEDUCTED FROM ACCOUNT BUT PAYMENT NOT SHOW SUCESS,Please check after sometimes.
Please start Early,Please check tomorrow.
I have no specific grievance,Thank You
Payment successfully debited from bank account but showing pending on admission website,Kindly check after sometime
I am not able to make college preference I am not getting that option,Kindly check after sometime
I have Full form fill up but not submit form please check this attached photo,kindly check after sometime
Form shows incomplete says registration details incomplete. I have completed everything in registration section but the page is inactive. I have called your call centre as well as emailed by there is no update please check urgently,"Please ensure you have filled all mandatory fields before locking the form. Once you successfully lock your Part I form, the status will automatically update to 'Completed'."
Not able to see part 2 form I've filled both the forms part 1 and 2 but only part 1 is showing to print,We are already working on that kindly verify/check after sometime.
"Tejal Madhav Kurhe Login Id No D0865639750 
Lock Application Erro","Please ensure you have filled all mandatory fields before locking the form. Once you successfully lock your Part I form, the status will automatically update to 'Completed'."
part 2 form is not visible,Kindly verify/check after sometime
"Dear Sir/Madam,
I cant see link for Application Form (Part-2). When it will be activated?",Kindly check after sometime
My correct roll number is 15136112and in form it is showing 151361112. How to change it please guide me,"We need your consent to change your roll number. Kindly share your details likes name, register mobile number, login id/application number, mail id, seat number and 10th marksheet and also Write a letter, mention your issue with your signature and attach 10th marksheet in grievance. Write grievance immediately."
Part-2 is not visible . I have selected the colleges but now i am not able to see part-2.,"Problem is resolved now, please try gain."
Part 1 is filled but part 2 is not accessible,Kindly verify/check after sometime
not able to lock,Kindly verify/check after sometime
CAP option Form,Kindly verify/check after sometime
my payment is successful but it is not reflecting in the payments page.,Kindly check after sometime
PAYMENT PAID TWO TIMES BUT NOT REFLECT IN APPLICATION,Check after 4 or 24 hours for bank reconciliation
"After Login and Completing Part one , PART II not Available for Selection",Kindly verify/check after sometime
option disable to Select admission through Inhouse Quota,Kindly verify/check after sometime
Actully i have done payment but there is no seen,Kindly check after sometime
Want admission to 11th class,You have to fill up the application form on this website https://mahafyjcadmissions.in
I have locked my part I application form. But part II is not getting visible. I cannot select colleges and save my choices.,"Already solved that issue, even if you are facing any problem provide screenshot"
Part2 of form is not coming in left side menubar,Please check again after some time
The Following VPA I have made Payment Twice But Still its Showing Pending,You will get you payment back except one within 7 working days.
"UPI transaction Id - 514714981939
Plzz solve my issue there is not showing the receipt",Kindly check after 3 to 4 hour
"I have done payment but can’t proceed so please confirm my transaction and forward option will be released in form 

Clear all errors in my form",Kindly check after sometimes
"Dear Sir/ Ma'am, 
Due to unknown reason, I'm not able to see the section ""Application Form (Part 2)"" in the menu, at left side top corner and thus unable to proceed further. Could you pls help me enabling the part 2 option, pls?",This issues is solve please Just relog Your account
"unable to lock registration form
showing registration details not field",Kindly note that payments made via PhonePe or other UPI apps may take some time to reflect. Just refresh you dashboard and check internet connection.
"The Payment page is not going through, see error image attached.
Also the two payments done on 26May2025 are not confirmed yet. 
A grievance GRVAPL1 was already raised for the same.",please check after Sometime
i paid fees online but they are showing again to pay,Kindly check after sometimes
Fee is paidon 26 may But still it is not reflected in the form,Kindly note that payments made via PhonePe or other UPI apps may take some time to reflect. Just refresh you dashboard and check internet connection.
"Application fee is deducted from our side, but the server is showing that the payment is pending. And we are also not getting the option to move ahead .",Kindly note that payments made via PhonePe or other UPI apps may take some time to reflect. Just refresh you dashboard and check internet connection.
"I already paid 100 rs bt it is not showing, i have transaction ID and everything, kindly look into it.",Kindly note that payments made via PhonePe or other UPI apps may take some time to reflect. Just refresh you dashboard and check internet connection.
Faced glitches with Part II yesterday in college list selection. Today the option for filling Part II is not showing at all.,"Now part II is available, please log in to fill the form."
"I have made payment through Google Pay.. upi transaction id is - 514714435370

google transaction id - CICAgKi4y-e4HQ

But playment is not reflected",Kindly note that payments made via PhonePe or other UPI apps may take some time to reflect. Just refresh you dashboard and check internet connection.
Payment has been debited from account but not reflecting,Kindly note that payments made via PhonePe or other UPI apps may take some time to reflect. Just refresh you dashboard and check internet connection
yesterday i fill part 1 form completely and i had also pay the amount and lock and self verified the form. later i stared to fill part 2 form to filling but it doesn't shows the the option for application part 2,"Now part II is available, please log in to fill the form."
i have filling part 1 in application form  1  but i cant felling 2 part because not showing collage selection part 2.,"Now part II is available, please log in to fill the form."
college option form not show,"Now part II is available, please log in to fill the form."
Part 2 link in left menu is missing. Very pathetically build site.,"Now part II is available, please log in to fill the form."
"Hi , we have completed the registration process on dated 26th May-2025, till yesterday CAP option ( collection selection) option visible, but today morning we are not able to view the CAP option. Kindly check and confirm","Now part II is available, please log in to fill the form."
"I have only saved the 10 choices of colleges. However, I am not finding any details of the saved college preferences. I have taken screenshot of the saved colleges data but am not able to retrieve the saved data. Also there is no option of SUBMIT button after the 10 preferred colleges data is saved. Please refer to the word document in which i have captured the 10 saved colleges data.","Now part II is available, please log in to fill the form."
Part I form is filled and lock application is done but the second part is not visible. how to fill the same????,"Now part II is available, please log in to fill the form."
we have made the payment it is not reflecting,Kindly check after sometimes
"Payment succesful but show pay again
Check screenshot",Kindly note that payments made via PhonePe or other UPI apps may take some time to reflect. Just refresh you dashboard and check internet connection.
"We have submitted Part I & locked the form , however we are not able to see Part II","Now part II is available, please log in to fill the form."
"CAP Option Form is not visible, only Application Form is visible on the site currently.","Now part II is available, please log in to fill the form."
2nd part of admition not showing,"Now part II is available, please log in to fill the form."
Part 2 of form not showing...,"Now part II is available, please log in to fill the form."
part2 is not visible,"Now part II is available, please log in to fill the form."
BY MISTAKE I LOCKED MY APPLICATION FORM WITHOUT SELECTING MY PREFERRED COLLEGES.  PLEASE HELP ME IN UNLOCKING THE APPLICATION FORM SO THAT I CAN ATTACH MY PREFERED COLLEGE.,Just relog Your account and unlock your form the option will be editable.
Form Part 2.. not showing,"Now part II is available, please log in to fill the form."
Form Part 2.. not showing,"Now part II is available, please log in to fill the form."
"I have been trying to access the part 2 form for nearly 2 days but it is not displaying on my screen.
Once it opened and when I went to lock the form, the site crashed and then I am not able to see it again. Please help me with this problem","Now part II is available, please log in to fill the form."
"Hi Team, there seems to be some glitch in the website , i am not getting an option to select the college name. I have completed my application form, but i am not able to proceed to the next section where the college name appears, Kindly look into this at the earliest","Now part II is available, please log in to fill the form."
not able to see CAP filling option,please provide the screenshot
Part2 not seeing,"Now part II is available, please log in to fill the form."
I have filled the paper 2 of the form and saved it but it it not visible and I am not able to lock it.,"Now part II is available, please log in to fill the form."
"Payment deducted for my account, but application payment is pending.  My UTR NO 514713836564
plz accept the payment and give mi open the next tab.",Kindly check after sometimes
amount for admissions form is been deducted but its it not displayed and not showing confirm why,Kindly check after sometime
today no CAP part 2 option is showing in dashboard,"Now part II is available, please log in to fill the form."
I can't fill in part 2,"Now part II is available, please log in to fill the form."
Cannot continue the application form as part 2 for preference selection is not visible,"Now part II is available, please log in to fill the form."
part 2 not display,"Now part II is available, please log in to fill the form."
PART 2 IS NOT VIEW,Please check after sometimes.
PLEASE ALLOW ME TO UP0LOAD MY FATHERS CASTE CERTIFICATE.  I BELONG TO OBC CATAGORY.  BUT FAILED TO ATTACH HIS CASTE CERTIFICATE AS I DO NOT HAVE ONE.,kindly upload your original document.
after locking part 1 form part 2 is not shown on display,"We are already working on that kindly verify/check after sometime.
To access Part 2 and select your college preferences, please ensure you have first locked your Part 1 form. After locking Part 1, refresh the page or log in again to proceed to Part 2."
PART2 Form Filling not visible for me,Kindly check after sometime
"CAP round section or part 2 section is not working, its only showing part 1, and this website is not working at all",Our team is on that we'll get back to you soon check after sometime
after completing and finishing my part 1 i am  unable to find the option of part 2 even i tried logging out,"We are already working on that kindly verify/check after sometime. 
To access Part 2 and select your college preferences, please ensure you have first locked your Part 1 form. After locking Part 1, refresh the page or log in again to proceed to Part 2."
my part2 form is not visible even though I have filled it and now I cannot edit it or unlock it,Kindly check after sometime
Payment Done through UPI but till not update on website.,Kindly check after 1 PM
"TUSHAR LAHU BHOYE
LOGIN ID :- D0727436730
मा. सर माझ्या लॉगीन ID वरून PAYMENT हे DONE झाले आहे परंतु पुन्हा PAYMENT साठी येऊ राहिले आहे 
सोबत पावती जोडली आहे",Please check tomorrow.
PAYMENT PAID BUT PAYMENT STATUS  STILL PENDING,Kindly note that payments made via PhonePe or other UPI apps may take some time to reflect. Just refresh you dashboard and check internet connection.
Form Part -II  is not opening or not appearing,"To access Part 2 and select your college preferences, please ensure you have first locked your Part 1 form. After locking Part 1, refresh the page or log in again to proceed to Part 2."
"I have made the payment 2 times,Payment has been deducted from my bank, please refund my money",You will get your refund within 7 working days
"I had submitreed 100 rupees as well as I had even locked tyhe form what should i do next in order to fill it and select the colleg
e",Go to the Part 2 and select your college preferences.
i want my part 2 form back so can get it back because i have not field the form,We are already working on that kindly verify/check after sometime
part 2 not available in portal. collage prefernce not complete .please availbale option part .,We are already working on that kindly verify/check after sometime
"Part 1 locked, but for filling up part 2, it is not showing in list.
It show only part 1 and Mis...","We are already working on that kindly verify/check after sometime. 
To access Part 2 and select your college preferences, please ensure you have first locked your Part 1 form. After locking Part 1, refresh the page or log in again to proceed to Part 2."
part 2 not showing,"We are already working on that kindly verify/check after sometime, 
To access Part 2 and select your college preferences, please ensure you have first locked your Part 1 form. After locking Part 1, refresh the page or log in again to proceed to Part 2."
"Dear Sir, Cap filling form Part -II not displayed in my dashboard, kinldy do the needful earliest","We are already working on that kindly verify/check after sometime. 
To access Part 2 and select your college preferences, please ensure you have first locked your Part 1 form. After locking Part 1, refresh the page or log in again to proceed to Part 2."
I had completed part - I but part-II not displaying. My son's friends have completed this part II. Screenshot attached. Request you to look into this at the earliest.,Kindly check after 7 PM
Yesterday evening could not able to add college in part-II and now unable to see Application Form (Part-II) in sight,Kindly check after 7 PM
how to resolve the date,We get data from board
.,Okay
PAYMENT NOT REFLECTED BUT DEDUCT FROM ACCOUNT,Please verify/check after sometime.
No problem,Thankyou for Grievance
Collage,?
option for not open,This issues is solve please Just relog Your account
I am unable to see part-2 for college selection and other.,Kindly check after sometime
payment done but still payment is not confirmed,please check tomorrow.
Part 2 of the the admission form is not visible on the dashboard,kindly check after sometime
"Respected Sir/ Madam, 

I, Aditya Sanjay Jaiswal,had filled and submitted my CAP part 2 form for FYJC admission through the portal. However, due to an oversight, I added only one college preference ( B.N.N  College) and locked the form without including other colleges.

I now understand that including Multiple Preferences is crucial to avoid non- allotment of limited options.As a result. I request you to kindly unlock my CAP Part 2 form so I can add more college options 

Here are my details for your reference: 
Student Name:- Aditya Sanjay Jaiswal 
Application ID:- A1008164346
Registered Mobile Number: 9730815318
Board :- SSC 
Region:- Bhiwandi 

Kindly help me in rectifying this mistake as soon as possible. I shall be grateful for your assistance 

Thanking you,

Your sincerely 
Aditya Sanjay Jaiswal 
9730815318
sj013297@gmail.com",We are already working on that kindly verify/check after sometime.
not showing application form part 2 for selecting college,Kindly verify/check after sometime
Payment pay by upi but in profile payment not recived,kindly check after sometime
part 2 option is not there,kindly check after sometime
part 2 option is not there,Kindly verify/check after sometime
part 2 option is not there,We are already working on that kindly verify/check after sometime.
part 2 option is not there,"Now part II is available, please log in to fill the form."
part 2 option is not there,Kindly verify/check after sometime
Part 2 form (college selection) not being displayed,Kindly check after sometime
transaction id T2505271441169620249921,Kindly check after sometime
"Dear Team 

My First payment is Done but not reflected in System but same other payment after 1 hours second payment is Done and accept 

Please Refund my Amount",You will get refund within 7 working days
