Grievance,RepliedGrievance
"I BELONG TO OBC CASTE, SO FOR THIS WE NEED TO UPLOAD NON CREAMY LAYER CERTIFICATE.
AS I DIDNT HAVE THIS CERTIFICATE, SO I HAVE APPLIED FOR NON CREAMY LAYER CERTIFICATE AT ANDHERI TEHSIL OFFICE, SO I WANTED TO CONFIRM CAN I UPLOAD THE SUBMISSION RECIPET OF NON CREAMY LAYER CERTIFICATE FOR ADMISSION PROCESS. ALSO I TAKE THE RESPONSIBILITY TO SUBMIT THE NON CREAMY LAYER CERTIFICATE AT THE TIME OF VERIFICATION OF DOCUMENTS",Yes.
"Dear Sir 
I have filled in all the details , paid fees as well . However i am not able to lock the form and go to the next section i.e. Part II 
I am getting error as : . Application form is incomplete : Missing sections : Registration Details . 
However pls find attached the screen shot , i have filled in all the required details . 
Kindly help me asap . 
Pls refer error screen shot - 1st screen shot 
2nd and 3rd screen shot is towards the details which has been submitted","Please ensure you have filled all mandatory fields before locking the Part 1 form. After locking Part 1, refresh the page or log in again to proceed to Part 2."
"Hello,

I am not able to add my preferred colleges to the preference list. My preferences are not being saved and the entire list disappears once we click on the next page.",We are already working on that kindly verify/check after sometime.
We are interested to learn about the teaching method of the college,Please mention your issue in detail
"We are not able to save the collee choices,. It resets and it gives an error. Kindly look in to this. Attached screenshot.",We are already working on that kindly verify/check after sometime
"Admission processing fee paid, but not reflecting as paid on the site",Please check after the 1 hour.
"My ward has ""Information Technology"" as ""Additional Subject"", shall I exclude that from the Best of Five? As the portal says optional subject should not be considered, please clarify, it will bring her % down by 2.50% if not considered.",Optional subject not be considered. Please fill only regular subject.
"search engine does not work properly and shows random results, not able to find garware college even after entering the udise code",Please check again.
My date of birth is incorrectly listed as 25/10/2008. My correct date of birth is 06/03/2009. I have tried to update this multiple times without success. Please advise on the process to correct it.,Unlock the form and you can edit birth date.
form does not proceed,"Kindly check after 1 PM

Thank You"
Mark shit,ok
I have paid application fees but it's hasn't yet been reflected on my account,Check after 4 or 24 hours for bank reconciliation
"Dear Team,
i selected a college and saved my preference. Then i selected 2nd college, however, i see same previously selected college in my saved preferences. Also, earlier i saved 6 unique colleges, those two got converted to a single college. Please enable selection of maximum 10 colleges as per the Govt guidelines.",This issues is solve please check it
I am getting error while selecting colleges and not allowing to save preference.,We are already working on that kindly verify/check after sometime.
"I have done my 10th from Jawahar Navodaya Vidyalaya Satara , (CBSE) and I have provided both UDISE and index number still system is not allowing me to choose InHouse quota.

Please could you help me to resolve this issue at the earliest . 

Thanks !",Please provide your school UDISE and index number immediately. Also provide screenshot of the same.
Dakhala,Please mention your issue in brief
Dakhala,Please mention your issue in brief
Dakhala,Please mention your issue in brief
Dakhala,Please mention your issue in brief
कॉलेज निवडताना एकाच कॉलेजचे अनेक कोड आहेत त्याप्रमाणे एकाच कॉलेजचे 3 कोड निवडले असता निवडलेल्या यादित एकच कोड दिसत आहे तसेच दुसरे कॉलेज निवडले असता किंवा डिलीट केले असता निवडलेले यादी संपूर्ण पूसली जात आहे. हा प्रॉब्लेम वारंवार प्रयत्न करूनही कॉलेज निवडण्याकरीता अडचणी निर्माण होत आहेत. तरी मार्गदर्शन व्हावे.,Please check after some time
I cannot lock my application form. It’s showing an error that Application form is incomplete Missing section: Registration details missing.,This issues is solve please Just relog Your account refresh the dashboard
"despite of entering correct school name and u-dise number of the school , system shows that i am not eligible for the inhouse quota , please fix this asap","Unlock your form, in personal details write school index and udise number. If you are eligible for inhouse quota, then it will automatically select yes for inhouse quota."
"r/s
there should be facility for selecting more than one medium of one specific stream.
In our Solapur there are, some good English medium commerce colleges, If their merit will go high at the same  we have to choose Marathi medium commerce colleges like not much famous, so that we will take admission to those colleges in Round 1 itself

Please do the needful",You can choose only one stream and medium at a time
"When the first college is selected and we proceed to select the second college, the first college entry is highlighted over to the second entry.
Secondly, the third college gets highlighted upon selection, but an error code appears.",Please check after some time
"Multiple selection done but shows choice code not selected and also colleges even though ""save choice"" are not showing up for locking",Please check after some time
"I am writing this to request a refund for the accidental payment made by me directly via UPI and instead of the official admission portal
In the choose file option, download the receipt of the payment and attach it there.",You will get you payment back except one within 7 working days.
I have to admission in ramanand DAV,Please mention your issue in brief and provide necessary documents.
"Im not able to select one college,if one college is selected its coming multiple times",Please check after some time
Some colleges in Kolhapur are not showing in the list.. so we are college preparance How to choose?,Please select stream and medium as it is necessary for college search.
Getting Error Registration Form incomplete while Locking Application form but no details pending for update,This issues is solve please Just relog Your account refresh the dashboard
The school UDISE 27251400821 is not getting recognise for within maharashtra catagory,Please mention issue in brief and provide necessary supporting  document
"Dear Team
In 'Choose Jr. Colleges' option, the system is not allowing to select multiple colleges. Only Single college is showing for all the selected colleges, which is a flaw in the programming/coding. Please take it up with web site development to resolve as this must be faced by all students. A student must able to select and save maximum 10 colleges as his/her preference as per the Govt rules which are circulated for this admission process.",This issues is solve please check it
"Hello,
I am unable to select more than 1 colleges in Part 2.
For example
If i select college under UDISE 27230209288 and it shows up under 1st preference, then i select college under UDISE 27230100549,   both entries will show same college. I changed the browser from Edge to Firefox, and also reloaded the PC. Also i restarted PC and tried after 1 hour, but same results.
Please assist.
My user ID ININ75200383499

Brgds
Clifford",This issues is solve please check it
While selecting colleges I am unable to give preferences of my choice. The moment I enter second preference the first one is getting added again and then I am not able to lock my choice.,Please check after some time
UNABLE TO ADD MORE THAN ONE COLLEGE. EVERTIME SELECTING A SECOND COLLEGE IT ADDS THE SAME COLLEGE NAME TO THE LIST WHICH HAS BEEN ALREADY SELECTED,Please check after some time
Could not add more than 1 college although 10 colleges were supposed to be added,Please check after some time
I pay the amount to lock the form but still payment is showing not paid please refund my money or update as soon as possible,Check after 4 or 24 hours for bank reconciliation
"Could not add more than 1 college as a preference, though we were supposed to add atleast 10 college preferences",Kindly verify/check after sometime
"Hello,

We are getting error while locking application part 1 having error incomplete registration details however we already filled all required info.

Please find attached snap for same and advice on name.",This issues is solve please Just relog Your account refresh the dashboard
"When I am choosing colleges the name of first college gets repeated second time, and when I try to click on 'save choices' an error pops out.",Please check after some time
In frist preference I selected terana college and in second preference I selected SCSH Jasai but it showing only terana college in both preference,Please check after some time
"I am writing to bring to your attention an issue I am facing with the payment for the registration fee. I have already completed the payment, but the system still shows the status as ""Pending,"" with a message asking me to wait for 30 minutes. It has now been over two hours, and the status has not changed.

 Could you kindly look into this issue and assist me in resolving it as soon as possible?

Thank you for your time and assistance. I look forward to your response.",Check after 4 or 24 hours for bank reconciliation
"While adding college list under Choose Jr. College, the first preference automatically gets removed from the list. Please review.",Please check after some time
"I am selecting 3 to 4 different college, but in the preference list the first preference college name is appearing against all selected college. Kindly help.",Please check after some time
We are unable to multiple college in preference list,Please check after some time
Under tab of choosing option for medium there is no option for selecting both medium i.e. Marathi and English at a time as we desire to choose other colleges also which are registered under English Medium .  If we choose option of medium as Marathi  then list of colleges having English medium is not displayed . There should be flexibility for choosing colleges irrespective of medium. Hence it is requested to add option for choosing  both medium i.e. Marathi and English at a time.,please provide screenshot
No other schools available only selected one school,Please mention your issue in brief with supported documents
Facing error  while adding multiple college only one college appears twice. Refer snapshot.,Please check after some time
unable to add colleges in CAP Option II Part. Showing error. College once added don't remain added in the list once the second college is added or selected.,Please provide screenshot
Jai hind school and jr college,Kindly mention your issue in brief
"Hello sir, there are three names of the same college, but when we select one by one, those colleges are not selected. While choosing, even if we name another college in the same taluka as same, the first college is not selected. please tell me the solution as soon as possible sir I am facing a lot of problems while choosing.",Please check after some time
"Hello sir, there are three names of the same college, but when we select one by one, those colleges are not selected. While choosing, even if we name another college in the same taluka as same, the first college is not selected. please tell me the solution as soon as possible sir I am facing a lot of problems while choosing.",Please check after some time
"Not able to add multiple college, appearing twice in lock option.",Please check after some time
Registration details,Please check again after some time
"I by mistake choose ""previously passed"" option and i wanted to choose ""fresher"" option
also i wanted to choose "" other board"" option but i choose ""SSC"" option
please let me change or make changes in this section","Write a letter , mention issue in detail with your signature and attach your marksheet in the grievance."
"I by mistake choose ""previously passed"" option and i wanted to choose ""fresher"" option
also i wanted to choose "" other board"" option but i choose ""SSC"" option
please let me change or make changes in this section","Write a letter , mention issue in detail with your signature and attach your marksheet in the grievance."
I selected correct option but After Selecting options Last Tab Shoes Wrong Option.,This issues is solve please check it
"When we fill option form and select preference then 1 item shows in table bellow.again when I select new colleges still old collge entry put in table ..meanse first option come twise in table

Why this happen ?",This issues is solve please check it
"First preference given was aided college.
Second preference wanted to add as unaided college. But its not getting added. 
If done thrice, it gets added, but then the duplicate aided college does not get deleted.
पहिला pref aided कॉलेज चा दिला. नंतर unaided अॅड केलं तर aided कॉलेजच पुन्हा add झाले. तीनदा केल्यावर unaided दिसू लागले, पण मग दोनदा अॅड झालेल्या aided पैकी एक delete होत नाही.",Please check again after some time
We have been trying to select colleges but while doing so we are unable to select more than 1 college its showing some requested choice code error. Kindly look into the issue and resolve it for us as soon as possible,Please check again after some time
payment done through upi but not updated in the form,Check after 4 or 24 hours for bank reconciliation
Payment was deducted but showing as pending and again its asking for payment,Check after 4 or 24 hours for bank reconciliation
"seat number is '15193095' but by mistake it got mentioned as '151193095'
there is no option to edit","Please write a letter, mention issue in detail with your signature and attach your marksheet in grievance."
WHILE ADDING MULTIPLE COLLEGE IT ADDS IN THE BASKET BUT DISPLAYS SAME COLLEGE NAME IN THE LIST. AND WHEN SAVED. IT GIVES ERROR. SCREEN SHOT IS ATTACHED. E.G. 1. i chose st mira's college 2. abeda inamdar but it displays st mira's in both the places and does not save and gives error.,Please check again after some time
11 admission,Please mention your issue in brief
not more than 9 colleges are displayed. Plz update and display all the colleges,Please check again after some time
Unabel to update Correct Birth date 16/04/2008 whereas application form show Default date 28/05/2010,You can edit your birth date in profile details
Though all form filling process is completed Application form 1 is not getting lock,Please check again after some time
Though all form filling process is completed Application form 1 is not getting lock,Please check again after some time
Lock nahi hi raha hai,Just relog Your account refresh the dashboard
Lock nahi hi raha hai,Just relog Your account refresh the dashboard
some college available in English while some in Marathi,Please select the medium you want.
I have filled every part of the form even made the payment but i still cant lock as its saying inccomplete please help out,Just relog Your account refresh the dashboard
application is proper but still not able to lock it,Just relog Your account refresh the dashboard after 2 pm
I am make a Payment and my payment is successful but in system my payment shows Validate Payment option. please solve my problem sir/mam.,your issue is resolved please login again and check
"I am writing to inform you about a payment issue on the FYJC admission portal for the Pune region.

I successfully completed the admission processing fee payment, but the portal still shows the “Pay” button and does not reflect the payment. I have not received any confirmation even though the amount is deducted",Check after 4 or 24 hours for bank reconciliation
"I have selected list of colleges  but before making preferences i clicked on  saved  option. Now i am not able to select colleges by preference list. 
Kindly reset and allow me to have preference in college selection",Please check after some time
"I am unable to select colleges as per my wish. after selecting first college, when we select another college for 2nd position, it changes its name as the first college, As shown in the picture. If we ignore it and select 3rd college and click save choice, it gives a error. Please fix it.",Please select again after some time
COULD NOT SELECT THE COLLEGES PROPERLY,Please check again after some time
Cannot add more than one college in the college preference list. List getting erased again and again.,Please kindly check after some time
I AM UNABLE TO ADD AND SAVE MULTIPLE COLLEGES IN MY LIST.,Please check again after some time
i am CBSE student and secured more marks in IT subject. can i select this subject for best of 5 in securing my FYJC college admission,You can add best of five subjects marks
when i choose another college to add but same colleges previously added will add again and again,Kindly check after some time
"Dear Sir,

I am trying to select 10 colleges but first preference is auto adding at number two too and i cant select more than 3 colleges. When I select 4th choice, already selected 3 choices are auto deleting and fourth is appearing as my 1st choice.
Pls help to fix urgently.",Kindly check after some time
"Hi Team,

Hope you're all doing well!

I wanted to bring to your attention a bug in the Choose Jr College section. While selecting colleges from the shortlist, I was able to successfully add the first college to the choice list. However, upon adding a second college, the first college's name gets duplicated, and the second college does not appear in the list.

I've attached a snapshot for your reference.

As the CAP admission process has already begun, I kindly request you to address this issue on priority.

Thanks and regards,
Samarth",Please check after some time
Requested choice code not matched. when clicked on a college,Please check after some time
unable to add other/any colleges,Please check again after some time
"I am unable to add colleges, it's giving me same college name again and again",Please check again after some time
When we add more colleges it shows Poona college name multiple times. Refer snapshot.,Please check after some time
"It is not taking more than 3 colleges and out of the 3, 1st pref gets added twice even on selecting 3 different colleges.",Please select again after some time
"Category & Reservation Details 

need to select EWS Category instead of General /Open",Please mention your issue in brief with necessary document
"NOT ABLE TO SELECT THE COLLEGES PROPERLY AND COULD SAVE THEM ALSO SHOWING THE COLLEGE CODE DID NOT MATCH, TRIED IT MANY TIMES,

SCREENSHOT IS ALSO ATTACHED HEREWITH",Please check again after some time
"Amount 102.36rupees
Tr id 514621806423
Date and time -26 May 2025, 9:44 pm 
Applicant name shraddha Apparao Gangawane 
Note -payment slip add doc",Check after 4 or 24 hours for bank reconciliation.
"Amount 102.36rupees
Tr id 514621806423
Date and time -26 May 2025, 9:44 pm 
Applicant name shraddha Apparao Gangawane 
Note -payment slip add doc",Check after 4 or 24 hours for bank reconciliation
"Amount 102.36rupees
Tr id 514621806423
Date and time -26 May 2025, 9:44 pm 
Applicant name shraddha Apparao Gangawane 
Note -payment slip add doc",Check after 4 or 24 hours for bank reconciliation
"the system does not allow me to select 
1. bmcc aided
2. bmcc unaided
at the same time",please provide screenshot
"AFTER ADDING ANY SUBSEQUENT COLLEGE PREFERENCE, NAME OF THE FIRST CHOOSEN COLLEGE IS NOT APPEARING IN THE LIST OF ALL SUCH CHOSEN COLLEGES.",Please check after some time
"AFTER ADDING ANY SUBSEQUENT COLLEGE PREFERENCE, NAME OF THE FIRST CHOOSEN COLLEGE IS NOT APPEARING IN THE LIST OF ALL SUCH CHOSEN COLLEGES.",Please check after some time
"Whenever try to select the different colleges,finally one college name is getting selected ,attached is the screenshot for reference, unable to select different colleges.",Kindly check after some time
"as i select few colleges and add it to my save choices , my preference list is empty, I am unable to select more than one college",Please check after some time
I have filled the application form properly with every detail checked twice then too in the end while I try to lock the form I am not able to do it as it is showing that registration details section missing in the application form although filled earlier. I think this is a problem from your end so please try to resolve this issue so that I can move further in filling my form.,Please check again after some time
I am not able to add more than 1 college,Please check after some time
Unable to select College,Please select after some time
"On clicking the add button beside a college, I am unable to add it to the list. Could you please advice?",Please check again after some time
"science in marathi medium mean question paper and books in marathi lang, Right?",Please select the medium you want.
"payment is done but it is showing in the form, check the receipt attached Below",Check after 4 or 24 hours for bank reconciliation.
"I am Aryan Maurya, I cleared my 10th exam (SSC) board in year 2025.

 However I wrongly choosen option of previously passed.

Now the fresher option is disabled and I am not able to register for college.

Please rectify this issue.
It would be very helpful if you can rectify this issue as soon as possible.",Please write letter with your signature and SCC marksheet upload the document
B.K. Birla collage name is doubled and after adding 2nd collage only birla collage is appear,Please check after some time
Payment made to FYJC(11 th) admission process registration fees but paid option not disable on form. Screen Shot for paid amount attached here with.,your payment is not success here. do payment again your 1st time transaction you get back with in 4 to 8 working days.
"If  we select two collages , prefer saved list shows one collage two times.",Please select after some time
"Dear Sir/Madam,
I am writing to bring to your attention about a technical issue I am facing on the official website for 11th Admission.
I am unable to select and finalize colleges through portal, which is affecting my admission process. Despite completing all required steps and submitting my preferences, the portal is not allowing me to confirm my college choice.
I kindly request your assistance in resolving this matter and guide me to the next step.
Please let me know if any further information is needed.",Please check after some time
"After adding 2nd college, the first preference is being repeated in the second choice also. Please look into the issue immediately.",Please check after some time
Payment deducted but still shows fee is pending,Check after 4 or 24 hours for bank reconciliation.
Plz recovery,Please check after some time
I have created the log in on 21st May 25 by filling all registration details. Today on 26th May 25 I have started filling other parts of part 1 by uploading all relevant documents of open category with fees paid of Rs. 100/-. However in lock form my current status is showing as incomplete and error message pop up as missing registration details even though all registration details are already filled during creating login id. Please refer to attached documents and help me to get this sorted.,Just relog Your account refresh the dashboard after 1 pm
"1. We are unable to add multiple Colleges  to the selected list after adding 2nd college into the selection all the selected colleges gets cleared from the choices. 
2. if college is having 2 codes like CGE and CNE unable to select both it gives only 1 choice which is selected 1st.",Please check after some time
"While the system allows to search for multiple colleges, the system adds the same colleges inspite of correct choice. This seems like system error, which needs to be fixed",Please check after some time
Inhouse Quota - Yes,Please describe your issue in brief and provide necessary document.
Not Able to select multiple college,Please check after some time
I selected Dr. Kalmadi High school and Jr. College which was saved and showing in the added list. Then second preference chosen was Fergusson College and added. But in the display it shows second preference also Dr. Kalmadi High school and Jr. College,Please check after some time
unable to add second choice college,Please check after some time
While adding colleges one gets added and while trying to add the next one the old one is not visible and still saving the choices this issue is there,Please check after some time
unable to select the 2 nd preference . while selecting the first its showing twice in list and after that trying to select second but is not getting select,Please check after some time
"If I add more than 1 college the selection is not getting saved, hence I had to submit the form with 1 option. The site is giving error to select more than 1 college",Please check after some time
