Grievance,RepliedGrievance
"This payment successfully done then again why do
Transaction I'd in file","It is completed , please check again"
"Even after successful payment, site is Showing payment failed / payment incomplete message. and hence not locking the form part -1.
Already we are facing the couple of issues while filling application on this site, neither any clarity given nor any  information (PDF) provided to fill this form easily. Department of education must be check a hassle free operation of this site before launching to end users, ie.students who are just 10 th.passed.","Please check after sometime, it will update accordingly
Sorry for inconvenience caused"
mesco jr colleges,"If you experience any issues during registration, please inform us. Please mention your issue in detail and attach necessary supporting document."
Already paid fees,Check after 4 or 24 hours for bank reconciliation.
"My payment for admission fee is not reflecting for application form 1.
Ref number - 514716711130",Check after 4 or 24 hours for bank reconciliation.
"Please allow us to select both if we dont get admission in english medium then we should have preference of marathi medium, kindly do the needful.

as in our district jalgaon, taluka chopda, there are only 6 colleges, 2 are english medium and 4 are marathi medium so, we get very less scope of options to select.

kindly take notice and provide relief.

thank you,
Dnyaneshwar Ingale
+91-7758884311",You can select only one stream and medium at a time.
"Fees have been completed on 27 May 2025 at 12:15 pm, but are displayed as pending.","Your payment has failed , please pay again and if any amount is debited before it will get refunded in 4 to 8 working days"
At the time of payment error shows 'your registration fee pending' and after validating same error showing and lots of time we try and after waiting 30 minutes same problem happened please solve this problem asap,"Please check after sometime, it will update accordingly
Sorry for inconvenience caused"
I had paid fees of registration still it showing to pay again that fees.,Check after 4 or 24 hours for bank reconciliation.
-,"If you experience any issues during registration, please inform us. Please mention your issue in detail and attach necessary supporting document."
o,"If you experience any issues during registration, please inform us. Please mention your issue in detail and attach necessary supporting document."
"i have paid the payment 3 times, but still showing that the payment is pending, but now at the 3rd time its done","Please check after sometime, it will update accordingly
Sorry for inconvenience caused, Your money will be credited in your account in 4 to 8 working days."
Not Sloved plz Cheq,if your payment is done no need to pay again. Our team working on that please check after sometime
No,"If you experience any issues during registration, please inform us. Please mention your issue in detail and attach necessary supporting document."
I made the payment but not upadted.,"It has completed successfully, check once again"
While doing online application wrong roll number input correct roll number is 15104044 and incorrect number in put 15104234. We are trying input with correct roll number that is 15104044 getting message you have already registered. But we do not register yet pls advice how can we go head and fill application part one form.,"Write a letter, mention your issue with your signature and attach 10th marksheet  in grievance. Write grievance immediately."
Amount of Rs.102.36 rs debited from my account but not updated.,Check after 4 or 24 hours for bank reconciliation.
Good,"If you experience any issues during registration, please inform us. Please mention your issue in detail and attach necessary supporting document."
"Hello,
I actually passed 10th std exam in March 2025 , but i accidentally selected March 2024 and saved the form. there is no option to change
Please Change it to March 2025.","Write a letter, mention your issue with your signature and attach 10th marksheet  in grievance. Write grievance immediately."
"Ramniranjan jhunjhunwala college of arts, commerce and science ghatkopar west this college name is not showing in the cap-2 form filling in the college list...","Please search college after 2 hours, we are working on it."
"Payment Done but not showing in the application form
Part 1 is locked 
Part 2 failed",kindly check after some times
"Enclosed receipt for your reference.
Do the needful as soon as possible.",Check after 4 or 24 hours for bank reconciliation.
"Dear Sir/ Ma'am,
I notice the Option to choose YES for Inhouse admission is greyed-out in the following screen, although school UDISE number is already entered in the previous screen field.

In Anticipation.","If the college is eligible for inhouse quota, the you will get inhouse option."
We don't find our preferred collages in the collages list,You need to select stream and medium correctly to search college. Please search college with full name.
"It is almost 30 hours but my amount is still not refunded and the transaction is showing as pending.

please find attached the screen shot of the same. The screen is not moving further kindly revert urgently as we need to fill the admission form.",you will get back between 4 to 7 working days.
Out of 10 colleges to be selected can I opt for commerce and science in different colleges,"No, You can select only one stream, either commerce or science."
Fees Has already been paid and receipt generated yet is asking to repay the fees again. Please check and confirm and also not allowing to upload the receipt.,"Please check after sometime, it will update accordingly"
I have already paid for the registration fees still showing pending pls look into it,"Sorry for inconvenience caused, Your money will be credited in your account in 4 to 8 working days."
"Greetings of the day,

I have made a payment if application fees via UPA under transaction no. 514715593351 ( Google transaction ID CICAgKi4u5uQMg) 

Kindly check & update the status of payment so, I will confirm the application form & start processing the further admission process.",Check after 4 or 24 hours for bank reconciliation.
"Greetings of the day,

I have made a payment if application fees via UPA under transaction no. 514715593351 ( Google transaction ID CICAgKi4u5uQMg) 

Kindly check & update the status of payment so, I will confirm the application form & start processing the further admission process.",Check after 4 or 24 hours for bank reconciliation.
"I want to change some registration details.

Changes to be made:

1. Applicant Status:
Change from Previously Passed to Freshers.


2. School Information:
In the section ""Have you passed from a Government / Zilla Parishad or Municipal School in Maharashtra?"", the Yes option is not clickable, but I want to select Yes.


3. Inhouse Quota Admission:
In the section ""Do you want to take admission through Inhouse Quota?""
I want to select Yes. However, it shows the following error message and the option is not clickable:
""As you have not filled School Index Number or UDISE Number, hence you cannot apply for Inhouse Quota.""



Please help me resolve these issues.","Write a letter, mention your issue with your signature and attach 10th marksheet  in grievance. Write grievance immediately."
3 times I made the payment on 26th May. the payment was deducted but it doesn't updated in the admission site. on 27th payment was accepted but could download the receipt. I have take the screenshot for refernce. Please check and help. Payment is still not shown and hence can't move ahead with next step. Login Id A2750969846,"Sorry for inconvenience caused, Your money will be credited in your account in 4 to 8 working days.

First payment will take time to initialize"
it's still showing incomplete even after filling all the details,"Please share screenshot for more details. If you experience any issues during registration, please inform us. Please mention your issue in detail and attach necessary supporting document."
Plz help me ?,kindly check after 2 to 3 hour
paid fees still showing error,Please share the error your error Screenshot
I paid the registration fees again by card it’s still not working what is this nonsense,"Payment is completed successfully, it will update accordingly"
My form fees is already paid but in online form not paid transaction ID 514718434251,Check after 4 or 24 hours for bank reconciliation.
"Dear sir / madam,
Our college is not visible on government portal.
Students are not able to fill part 2.
They are not able to choose our college.
We are very worried. We have huge intake capacity. If students are not able to select our college we wont be able to fill our college seats. Many teachers will loose job. 
There is a high stake.","You need to select stream and medium correctly to search college. Please search college with full name. And if you still face any issue, please let us know in detail."
ON 27TH MAY 2025  AT 02:39 pm i have successful payment from UPI id 9209167116@ybl with ref no: utr514714899609 but there is no payment shown on shaikh Areeb abdul Azim login. So please check & confirm,"It is initialized , it will get updated accordingly"
I paid fee of rupees 102.36/- and similarly deducted from my bank. Confirmation message also show. but in form showing fee is pending.,Check after 4 or 24 hours for bank reconciliation.
3 baar payment hu fir bhi part 1 lock hokar fail ho jaa rha hai,Please provide the screenshots
No issues faced while filling the form.,Thank you!
SNEHA 11TH ADMISSION,"If you experience any issues during registration, please inform us. Please mention your issue in detail and attach necessary supporting document."
My form fees already paid,Check after 4 or 24 hours for bank reconciliation.
Arts,"If you experience any issues during registration, please inform us. Please mention your issue in detail and attach necessary supporting document."
"Registration fees paid but showing not paid ( payment is in pending ) 
here is the payment receipt",Check after 4 or 24 hours for bank reconciliation.
"Registration fees paid but showing not paid ( payment is in pending ) 
here is the payment receipt",Check after 4 or 24 hours for bank reconciliation.
I want to change my applicant's status from previously passed to fresher,"Write a letter, mention your issue with your signature and attach 10th marksheet  in grievance. Write grievance immediately."
Ramniranjan jhunjhunwala college not listed fir choice selection,You need to select stream and medium correctly to search college. Please search college with full name.
"hi 

Kindly refund my failed payment  
we have made admission processing fee payment 2 times because first payment has not been updated on side but dedication has been done from my account 

Kindly find attachment of SS

Regards 
Triveni Mane 
9820059891","Sorry for inconvenience caused, Your money will be credited in your account in 4 to 8 working days."
Paid fees 5 times. also shows successful but when i press next the lock form is not generated,You will get your refund after 4 to 6 working day and Kindly ensure all mandatory fields are filled and documents uploaded.
No,"If you experience any issues during registration, please inform us. Please mention your issue in detail and attach necessary supporting document."
"PLS MAKE A NOTE STUDENT NAME IS "" KAAYAAN"" AND SURNAME IS "" RAAJAANI "".
ALL RECORDS STAND AS "" KAAYAAN RAAJAANI""
WE REQUEST TO NOT ADD ANYTHING IN MIDDLE SO PLS REMOVE ' NULL' 
 WE WANT IT TO BE ""KAAYAAN RAAJAANI""
DO THE NEEDFUL CORRECTION .PLEASE","Write a letter, mention your issue with your signature and attach 10th marksheet  in grievance. Write grievance immediately."
मी 2024 मध्ये 10 उत्तीर्ण झालो आहे. तरी. मी 2024 मध्ये. कोणत्याही महाविदयाल्या मध्ये. प्रवेश घेतला नाही. 11 वी प्रवेश फॉर्म भरताना माझी  जन्म तारीख चुकली आहे. माझी जन्म तारीख 10/08/2004 अशी असून. चुकलेली दुरुस्त करावी,"If you want to edit your birth date , you can unlock form and edit birth date."
Na,"If you experience any issues during registration, please inform us. Please mention your issue in detail and attach necessary supporting document."
Sir i Have Pay Payment But Side Issue Mule Dist nhi ahe kay karu,Check after 4 or 24 hours for bank reconciliation.
"This is reminder to my my previous grievance U/no, - GRVAPL2 dated 27/05/2025 00:50:55 and in continuous to grievance U/no, - GRVAPL1 dated 27/05/2025 00:44:39 followed by your Your response dated 27/05/2025 10:15:46
Fee payment deducted from my bank account U/no. UPI 514616837973 date 26/05/2025 time 17:34 but then too it shows Your Registration Fee is Pending

Even I have tried  validate option but it's stuck or it redirect me to payment page

Moreover your helpline numbers are non-operative and non responsive",your issue is resolved please login again and check
Payment done but still showing as pending. More than 8hrs completed since payment done.,"Please check after sometime, it will update accordingly
It is completed"
I had made the payment online. It was deducted from the account but it is still not showing here,Check after 4 or 24 hours for bank reconciliation.
Payment is done but in the portal it is not showing,Check after 4 or 24 hours for bank reconciliation.
"some of the best colleges for commerce are not visible in the list such as 
 - vivek college of commerce (goregaon west)
- Nagindas khandwala college (malad west)",You need to select stream and medium correctly to search college. Please search college with full name.
"Dear sir/madam,
I have paid my application fee by upi but the payment status is not showing. I have receipt of payment and the screenshot of upi",Check after 4 or 24 hours for bank reconciliation.
"Application fees rs 102.36 is Payed Successfully in upi id - 9970034109@axl but in application form not showing the payment status.
Still they showing fees pending status",Check after 4 or 24 hours for bank reconciliation.
I pay fees but payment status is pending and the amount is debited by my account,"Already your 4 payments are initialized . so it is taking time, so kindly request you to wait for sometime"
I have made the payment second,This issues is solve please Just relog Your account
"Payment noy showing. Unable to select college, it's showing Error.","Please check after sometime, it will update accordingly"
Showing error in CAP.,Please try again after some time
I have searced for ramniranjan jhunjhunwala college ghatkopar west but it is not showing in the list,You need to select stream and medium correctly to search college. Please search college with full name.
I have paid three time application fee  but application fee showing pending it's not good  please understand my solve it as early as,Kindly check after 3 to 4 hour
Stream in english and Marathi not selected,You need to select stream and medium correctly to search college. Please search college with full name.
System is throwing continuous error. I have received the payment successfully done successfully messege.  I locked the part 1 Of application but still it is not allowing me to process further. It is still showing error. Screenshot attached,Please try again after some time
Unable to process. System flashing error. Please suggest.,Please try again after some time
Unable to process. System flashing error. Please suggest.,Please try again after some time
Unable to process. System flashing error. Please suggest.,Please try again after some time
Unable to process. System flashing error. Please suggest.,Please try again after some time
"I have paid the 100 rupees tomorrow at 4 pm  by Gpay but shows not paid/pending from last 18 hours,plz look the matter",Check after 4 or 24 hours for bank reconciliation.
"I paid the amount, but the site is not confirming my payment",Check after 4 or 24 hours for bank reconciliation.
When I was adding colleges the added colleges were getting deleted many times. So everytime I have to create a new list again. Please solve all this problems.  And also the search colleges option is of no use. I literally searched colleges from the list.,You need to select stream and medium correctly to search college. Please search college with full name.
"Tomorrow I have done payment at 6 pm,still shows pending pls do tbe needdul",Check after 4 or 24 hours for bank reconciliation.
"I am to opt in Gujarati Minority quota, when it will get started?","It is there in the form, you can apply immediately."
"User Login ID: A2495215427.
Even after successfully locking the part 1 of admission process. It is still showing error. Unable to open part2. Again payment pending window is popping. Customer care is not responding on this issue they only say we have to wait. I don't know how to resolve this issue. Thanks Maya 9967484377",Please try again after some time
I've already paid twice but it is still asking me to pay.,Check after 4 or 24 hours for bank reconciliation.
I payed my fees but the form is not submitted,"Please check after sometime, it will update accordingly"
I have made the fees payment but again it showing to make the payment of fees,Check after 4 or 24 hours for bank reconciliation.
"My self Rameshwari Samadhan Salve, from nashik.. i have filled FYJC Application form for 11th admission & make the payment of application but till not reflect payment on portal my application detail & payment details mention below

Application ID -   D0203733715
Payment mode-   UPI
Payment UTR no-  514614201997

i request u please solve my problem as soon as possible for further process..",Check after 4 or 24 hours for bank reconciliation.
No,"If you experience any issues during registration, please inform us. Please mention your issue in detail."
"Payment window is not coming, Only Validation window is coming. After Clicking on validate, not processing further.","Please check after sometime, it will update accordingly"
"Hi some well known colleges of commerce in Pune like bmcc,garware,so,MMC are not there in the list",Please select college stream and medium correct and search college by full name. These colleges are in the list.
Not done validation  so please give me solution,Check after 4 or 24 hours for bank reconciliation.
"Sir,
yesterday am trying to call helpline number for whole day... But no response none were bother to pick up my phone.. Please help me urgent.. I have entered wrong seat number during registration step.. My correct seat number is 8662597. Further i have not received any email or SMS regarding the Login id.. Please see my Hall ticket attached herewith. Please call me on 8369114730. Please change my Seat number either from your side or let me know how to change. I also informed to support team through e-mail dtd 27.05.2025 time 8.29am but no response from them too.. How i can proceed further..i am trying to submit pdf or pic of admit card but always show error in red.. Please Help me urgently","Write a letter, mention your issue with your signature and attach 10th marksheet  in grievance. Write grievance immediately."
"Sir,
yesterday am trying to call helpline number for whole day... But no response none were bother to pick up my phone.. Please help me urgent.. I have entered wrong seat number during registration step.. My correct seat number is 8662597. Further i have not received any email or SMS regarding the Login id.. Please see my Hall ticket attached herewith. Please call me on 8369114730. Please change my Seat number either from your side or let me know how to change. I also informed to support team through e-mail dtd 27.05.2025 time 8.29am but no response from them too.. How i can proceed further..i am trying to submit pdf or pic of admit card but always show error in red.. Please Help me urgently","Write a letter, mention your issue with your signature and attach 10th marksheet  in grievance. Write grievance immediately."
"Sir,
yesterday am trying to call helpline number for whole day... But no response none were bother to pick up my phone.. Please help me urgent.. I have entered wrong seat number during registration step.. My correct seat number is 8662597. Further i have not received any email or SMS regarding the Login id.. Please see my Hall ticket attached herewith. Please call me on 8369114730. Please change my Seat number either from your side or let me know how to change. I also informed to support team through e-mail dtd 27.05.2025 time 8.29am but no response from them too.. How i can proceed further..i am trying to submit pdf or pic of admit card but always show error in red.. Please Help me urgently","Write a letter, mention your issue with your signature and attach 10th marksheet  in grievance. Write grievance immediately."
Payment status show pending from last 12 hours .but money deducted from account,"Please check after sometime, it will update accordingly"
Not uploaded,"If you experience any issues during registration, please inform us. Please mention your issue in detail and attach necessary supporting document."
"फॉर्म भरल्यानंतर आपण कोणची ब्रांच घेणार आहोत कम्प्युटर सायन्स, क्रॉप सायन्स, इलेक्ट्रॉनिक्स, फिशरी किंवा जनरल सायन्स हे भरायची ऑप्शन दिले नाही आहेत. नंतर एखाद्या कॉलेजमध्ये नंबर लागल्यावर, एखादा मुलगा जेईई करत असेल तर त्याला कम्प्युटर सायन्स घ्यावाच लागते किंवा इलेक्ट्रॉनिक्स ; पण कॉलेज वाल्यांनी त्या मुलाची नाव जनरल सायन्स मध्ये टाकले तर त्याचा काहीही फायदा नाही आहे. किंवा मुलगा नीट करत असेल तर त्याला क्रॉप सायन्स पाहिजे आणि त्या मुलाचे नाव कम्प्युटर सायन्स मध्ये किंवा जनरल सायन्स मध्ये टाकले तर त्या मुलाची काय फायदा आहे त्याला दोन्ही विषय मॅथ्स व बायोलॉजी करावे लागतील हे तर त्या मुलासाठी अवघड झाले. हे सर्व तर चुकीचा आहे .पोर्टलवर कोणती ब्रांच पाहिजे याचे ऑप्शन दिले पाहिजे.","You can select bifocal subjects. If you experience any issues during registration, please inform us. Please mention your issue in detail and attach necessary supporting document."
"Hi
I successfully paid admission process fees rs 100 but I can't got any massage of done payment successfully and here said your form is incomplete....
I am attaching my transaction......","Please check after sometime, it will update accordingly"
EWS to SEBC Cast Change,"You can unlock form and change details you want, but everything will erase, you need to enter details again."
application online payment done from my side but did not show in portal ( upi id : lokeshvishe143@okaxis),Check after 4 or 24 hours for bank reconciliation.
"Dear sir,
    My name is Alpana  Ramniranjan Vishwakarma and My Application no J0918348996.
     I made the payment through online app and the money got deducted from my account but it is still showing as pending.
          Transaction ID :- T2505272203120528396109
        UTR Number :- 100632206739
      Sir please complete my payment otherwise return my payment to me.
                          Thank you",Check after 4 or 24 hours for bank reconciliation.
"Dear sir,
    My name is Alpana  Ramniranjan Vishwakarma and My Application no J0918348996.
     I made the payment through online app and the money got deducted from my account but it is still showing as pending.
          Transaction ID :- T2505272203120528396109
        UTR Number :- 100632206739
      Sir please complete my payment otherwise return my payment to me.
                          Thank you",Check after 4 or 24 hours for bank reconciliation.
While filling the form earlier at 11.52 am on 27.05.2025 ragistration fee of Rs.102.36 was paid and debited from my account with transaction ID no.514711584991 but it didn't appear in on line form therefore I paid it again at 8.00 pm.on same date. Please refund me earlier fee credited to government.,"Please check after sometime, it will update accordingly
Sorry for inconvenience caused, Your money will be credited in your account in 4 to 8 working days."
"Fee Already sent by GPay, message showing fee pending",Check after 4 or 24 hours for bank reconciliation.
While filling the form earlier at 11.52 am on 27.05.2025 ragistration fee of Rs.102.36 was paid and debited from my account with transaction ID no.514711584991 but it didn't appear in on line form therefore I paid it again at 8.00 pm.on same date. Please refund me earlier fee credited to government.,"Please check after sometime, it will update accordingly
Sorry for inconvenience caused, Your money will be credited in your account in 4 to 8 working days."
UDISE number of 10 th class is different,"Yes, You can unlock form and change details you want, but everything will erase, you need to enter details again."
